Job Title,Company,Location,Salary,Job Type,Experience Required
Machine Learning Engineer Graduate (Search Ads) - 2025 Start (BS/MS),TikTok,"San Jose, CA","$113,500 - $250,000 a year",Job Type Not Listed,0
Machine Learning Engineer,Goliath Partners,"San Francisco, CA","$200,000 - $300,000 a year",Job Type Not Listed,0
Machine Learning Researcher,Kiddom,"San Francisco, CA","$130,000 - $180,000 a year",Full-time,0
Software Engineer 1 - Machine Learning,Abacus.AI,"San Francisco, CA",Salary Not Listed,Job Type Not Listed,0
"Machine Learning Engineer, GenAI Search",Moveworks.ai,"Mountain View, CA","$120,000 - $249,000 a year",Full-time,0
Data Scientist,BICP,"San Francisco, CA",Salary Not Listed,Job Type Not Listed,0
"Machine Learning Engineer, Training",Waymo,"Mountain View, CA","$158,000 - $200,000 a year",Full-time,0
Machine Learning Researcher,Apple,"Sunnyvale, CA","$143,100 - $264,200 a year",Job Type Not Listed,0
Production Engineer (University Grad),Meta,"300 Airport Boulevard, Burlingame, CA 94010","$117,000 - $137,000 a year",Job Type Not Listed,0
Prompt Engineer,LogicMonitor,"San Francisco Bay Area, CA","$130,900 - $180,070 a year",Job Type Not Listed,0
Machine Learning Engineer,Headway Technologies Inc,"595 Yosemite Dr, Milpitas, CA 95035","$96,655 - $142,140 a year",Full-time,0
Machine Learning Research Engineer,Video.io,"San Francisco, CA",Salary Not Listed,Job Type Not Listed,0
"Machine Learning Engineer, Search Recommendation",TikTok,"San Jose, CA","$112,000 - $250,000 a year",Job Type Not Listed,0
Machine Learning Engineer,Qualcomm,"Santa Clara, CA","$181,000 - $272,000 a year",Job Type Not Listed,0
"AIML - Machine Learning Engineer, Siri Perception",Apple,"San Francisco, CA","$143,100 - $264,200 a year",Job Type Not Listed,0
Machine Learning Engineer,Qualcomm,"Santa Clara, CA","$181,000 - $272,000 a year",Job Type Not Listed,0
Product Support Data Scientist,Apple,"Sunnyvale, CA","$136,300 - $205,500 a year",Full-time,3+ years
Machine Learning Research Engineer,Video.io,"San Francisco, CA",Salary Not Listed,Job Type Not Listed,0
"Software Dev Engineer - Machine Learning Apps, Accelerator, Annapurna ML",Annapurna Labs (U.S.) Inc.,"Cupertino, CA","$99,500 - $200,000 a year",Full-time,0
Computer Vision/Machine Learning Engineer,KLA,"Milpitas, CA","$124,100 - $211,000 a year",Full-time,0
LLM Research Scientist Graduate (eCommerce Recommendation)- 2025 Start (MS),TikTok,"San Jose, CA","$113,500 - $177,000 a year",Job Type Not Listed,0
Machine Learning Researcher,Apple,"Sunnyvale, CA","$143,100 - $264,200 a year",Job Type Not Listed,0
Software Engineer - Machine Learning,SLAC National Accelerator Laboratory,"2575 Sand Hill Rd, Menlo Park, CA 94025","$116,000 - $170,000 a year",Temporary,1+ years
SoC Machine Learning Design Engineer,Apple,"Cupertino, CA","$121,900 - $183,600 a year",Job Type Not Listed,0
Machine Learning Engineer Graduate (On-Device AI) - 2025 Start (PhD),TikTok,"San Jose, CA","$136,800 - $205,000 a year",Job Type Not Listed,1+ years
2025 University Graduate - Research Scientist/Engineer,Adobe,"601 Townsend Street, San Francisco, CA 94103","$120,700 - $228,600 a year",Full-time,0
Data Scientist / ML Engineer,Paradyme Management,"1400 Seaport Blvd Ste 200a, Redwood City, CA 94063","$123,000 - $185,000 a year",Full-time,0
Machine Learning Engineer - Content Growth,TikTok,"San Jose, CA","$126,000 - $221,760 a year",Job Type Not Listed,0
Staff Machine Learning Compiler Engineer,Rivian,"607 Hansen Way, Palo Alto, CA 94304","$206,500 - $258,100 a year",Full-time,0
"Machine Learning Engineer, On-Device ML",Grammarly,"San Francisco, CA","$337,000 - $403,000 a year",Job Type Not Listed,0
Applied AI Research Scientist - Reinforcement Learning,Meta,"1 Hacker Way, Menlo Park, CA 94025","$147,000 - $208,000 a year",Job Type Not Listed,0
Staff Machine Learning Compiler Engineer,Rivian,"607 Hansen Way, Palo Alto, CA 94304","$206,500 - $258,100 a year",Full-time,0
"Research Engineer, LLM",Anyscale,"San Francisco, CA","$170,112 - $237,000 a year",Full-time,4+ years
"Machine Learning Engineer, On-Device ML",Grammarly,"San Francisco, CA","$337,000 - $403,000 a year",Job Type Not Listed,0
"Research Scientist, Multimodal Machine Learning - Trust and Safety",TikTok,"San Jose, CA","$145,000 - $250,000 a year",Job Type Not Listed,3+ years
AI Engineer Robotics,BayOne,"4637 Chabot Dr Ste 250, Pleasanton, CA 94588","$100,000 - $1,000,000 a year",Job Type Not Listed,0
"Machine Learning Engineer, Tapestry",Loon,"Mountain View, CA","$160,000 - $220,000 a year",Full-time,0
"Machine Learning Engineer, Trust and Safety - USDS",TikTok,"Mountain View, CA 94041","$145,000 - $250,000 a year",Job Type Not Listed,0
"Software Dev Engineer - AI/ML, AWS Neuron Distributed Training",Amazon.com Services LLC,"Cupertino, CA","$99,500 - $200,000 a year",Full-time,0
Algorithm Engineer (Deep Learning/C++)(E),KLA,"Milpitas, CA","$100,100 - $172,200 a year",Full-time,0
Hewlett Packard Labs - Scientific Machine Learning Research Engineer,Hewlett Packard Enterprise,"Milpitas, CA 95035","$117,500 - $270,000 a year",Full-time,0
Machine Learning Engineer,Orbital Sidekick,"San Francisco, CA","$100,000 - $160,000 a year",Full-time,0
Machine Learning Algorithm Validation Engineer,Apple,"Cupertino, CA","$136,300 - $248,700 a year",Job Type Not Listed,0
ML Engineer,Delart,"Sunnyvale, CA",Salary Not Listed,Job Type Not Listed,0
"Machine Learning Engineer, Early Stage Project",Loon,"Mountain View, CA","$160,000 - $210,000 a year",Full-time,0
